fm_id,type,Title,alternative_title,language,y1,y2,d1,d2,m1,m2,format,place_id_fk1,place_id_fk2,link,ext_notes,import
1577,printed,Naturalium quaestionum libri omnes,0,Latin,1532,1532,0,0,0,0,2o,2,0,http://www.odis.be/lnk/en/PB_45723,0,Imported from 20231128_ml_ingest_odis_ml_pb.json
1578,printed,"Auctarium in secundum topicorum Aristotelis, compectens absolutum inventionis dialecticae methodum",0,Latin,1537,1537,0,0,0,0,2o,2,0,http://www.odis.be/lnk/en/PB_45727,0,Imported from 20231128_ml_ingest_odis_ml_pb.json
1579,printed,In hoc volumine continentur Porphyrii Phoenicis Isagoge [...] introductio in dialecticen [...] In usum & utilitatem Paedagogiorum in inclyta Universitate Lovaniensi liberales artes profitentium ...,0,Latin,1532,1532,0,0,0,0,2o,2,0,http://www.odis.be/lnk/en/PB_45735,<p>philosophy =&gt; logic</p><p>textbook contains different books from Aristotle and an isagoge of Porphyrius</p><p>=&gt; Liber praedicabilium of Porphyrius</p><p>=&gt; Liber praedicamentorum of Aristotle</p><p>=&gt; Liber peri hermenias dividitur in duos libros partiales</p><p>=&gt; Liber topicoum Aristotelis in octo libros partiales dividitur</p><p>=&gt; Liber priorum analyticorum in duos dividitur</p><p>=&gt;&nbsp;Liber posteriorum Aristotelis =&gt; 2 books</p><p>=&gt; Liber elenchorum dividitur in duos libros partiales</p>,Imported from 20231128_ml_ingest_odis_ml_pb.json
1580,printed,"Commentaria in isagogen Porphyrii, et in omnes libros de dialectica Aristotelis",0,Latin,1535,1535,0,0,0,0,2o,2,0,http://www.odis.be/lnk/en/PB_45736,<p>philosophy =&gt; logic</p>,Imported from 20231128_ml_ingest_odis_ml_pb.json
1581,printed,"Insunt in hoc codice naturalium quaestionum libri omnes, quibus clarissima liberalium artium facultas inclytae academiae Lovaniensis suos tirones ad rerum naturae cognitionem instituit",0,Latin,1547,1547,0,0,0,0,2o,2,0,http://www.odis.be/lnk/en/PB_45737,0,Imported from 20231128_ml_ingest_odis_ml_pb.json
1582,printed,Ethicorum sive moralium Nicomachorum libri decem,0,Latin,1548,1548,0,0,0,0,8o,2,0,http://www.odis.be/lnk/en/PB_45740,<p>ethics</p><p>moral philosophy</p>,Imported from 20231128_ml_ingest_odis_ml_pb.json
1583,printed,Ethicorum sive moralium Nicomachorum libri decem,0,Latin,1549,1549,0,0,0,0,8o,2,0,http://www.odis.be/lnk/en/PB_45741,<p>ethics</p><p>moral philosophy</p>,Imported from 20231128_ml_ingest_odis_ml_pb.json
1584,printed,Naturalium quaestionum libri omnes,0,Latin,1555,1555,0,0,0,0,2o,2,0,http://www.odis.be/lnk/en/PB_45742,"<p>natural philosophy</p><p>textbook contains various books of Aristoteles which follow a typical course on natural philosophy (p2-307)</p><p>=&gt; 8 books of the&nbsp;<em>Physica =&gt;&nbsp;</em>translation of Johannes Argyropoulos</p><p>=&gt; 4 books of&nbsp;<em>De</em>&nbsp;<em>Coelo =&gt;&nbsp;</em>translation of Johannes Argyropoulos</p><p>=&gt; 2 books of&nbsp;<em>De generatione &amp; corruptione =&gt;&nbsp;</em>translation of François Vatable</p><p>=&gt;&nbsp;4 books of&nbsp;<em>De Meteoris =&gt;&nbsp;</em>translation of François Vatable</p><p>=&gt;&nbsp;3 books of&nbsp;<em>De Anima =&gt;&nbsp;</em>translation of Johannes Argyropoulos</p><p>textbook contains also other works of Aristoteles</p><p>=&gt; book of&nbsp;<em>De sensu &amp; sensibilis =&gt;&nbsp;</em>translation of François Vatable</p><p><em>=&gt;&nbsp;</em>book of&nbsp;<em>De memoria &amp; reminiscentia =&gt;&nbsp;</em>translation of François Vatable</p><p><em>=&gt;&nbsp;</em>book of&nbsp;<em>De somno &amp; vigilia =&gt;&nbsp;</em>translation of François Vatable</p><p><em>=&gt;&nbsp;</em>book of&nbsp;<em>De insomniis =&gt;&nbsp;</em>translation of François Vatable</p><p><em>=&gt;&nbsp;</em>book of&nbsp;<em>De divinatione per somnium =&gt;&nbsp;</em>translation of François Vatable</p><p><em>=&gt;&nbsp;</em>book of&nbsp;<em>De longitudine &amp; bevitate vitae</em>&nbsp;=&gt; translating of François Vatable</p><p><em>=&gt;&nbsp;</em>book of&nbsp;<em>De iuventute et senectute, et vita, et morte &amp; et spiratione =&gt;&nbsp;</em>translation of François Vatable</p>",Imported from 20231128_ml_ingest_odis_ml_pb.json
1585,printed,Ethicorum sive moralium Nicomachorum libri decem,0,Latin,1560,1560,0,0,0,0,8o,2,0,http://www.odis.be/lnk/en/PB_45745,<p>ethics</p><p>moral philosophy</p>,Imported from 20231128_ml_ingest_odis_ml_pb.json
1586,printed,"Commentaria in Isagogen Porphyrii, et in omnes libros Aristotelis de dialectica [...] facultatis artium in inclyta Academia Lovaniensi per dialecticæ [...] emendata, & multis in locis prudeter abbreviata",0,Latin,1553,1553,0,0,0,0,2o,2,0,http://www.odis.be/lnk/en/PB_45751,0,Imported from 20231128_ml_ingest_odis_ml_pb.json
1587,printed,"In Aristotelis Stagiritae, philosophorum omnium principis, de rebus naturalibus libros brevis ac dilucidus commentarius",0,Latin,1567,1567,0,0,0,0,2o,2,0,http://www.odis.be/lnk/en/PB_45757,<p>natural philosophy</p>,Imported from 20231128_ml_ingest_odis_ml_pb.json
1588,printed,In Aristotelis de rebus naturalibus libros brevis commentarius,0,Latin,1577,1577,0,0,0,0,2o,2,0,http://www.odis.be/lnk/en/PB_45758,<p>natural philosophy</p><p>contains a commentary on the following books of Aristotle:</p><p>=&gt; the 8 books of the Physica:&nbsp;<em>De auscultatione physica =&gt;&nbsp;</em>from p5-110</p><p>=&gt; on 2 books of&nbsp;<em>De generatione &amp; corruptione</em>&nbsp;=&gt; from p111-133</p><p>=&gt; on 3 books of&nbsp;<em>De Anima&nbsp;</em>=&gt; from p134-184</p><p><em>=&gt;&nbsp;</em>on&nbsp;4 books of&nbsp;<em>De Caelo</em>&nbsp;=&gt; p185-226</p><p>=&gt; on 4 books of&nbsp;<em>De Meteoris</em>&nbsp;=&gt; p227-271</p>,Imported from 20231128_ml_ingest_odis_ml_pb.json
1589,printed,In Aristotelis de rebus naturalibus libros brevis ac dilucidus commentarius,0,Latin,1579,1579,0,0,0,0,2o,2,0,http://www.odis.be/lnk/en/PB_45759,"<p>natural philosophy</p><p>contains a commentary on the following books of Aristotle:</p><p>=&gt; the 8 books of the Physica:&nbsp;<em>De auscultatione physica =&gt;&nbsp;</em>from p5-110</p><p>=&gt; on 2 books of&nbsp;<em>De generatione &amp; corruptione</em> =&gt; from p111-133</p><p>=&gt; on 3 books of&nbsp;<em>De Anima&nbsp;</em>=&gt; from p134-184</p><p><em>=&gt; </em>on&nbsp;4 books of&nbsp;<em>De Caelo</em> =&gt; p185-226</p><p>=&gt; on 4 books of&nbsp;<em>De Meteoris</em> =&gt; p227-271</p><p><br data-mce-bogus=""1""></p>",Imported from 20231128_ml_ingest_odis_ml_pb.json
1590,printed,"In Aristotelis Stagiritae, de rebus naturalibus libros brevis ac dilucidus commentarius",0,Latin,1581,1581,0,0,0,0,2o,2,0,http://www.odis.be/lnk/en/PB_45760,<p>natural philosophy</p>,Imported from 20231128_ml_ingest_odis_ml_pb.json
1591,printed,Compendium et synopsis in decem libros ethicorum,0,Latin,1567,1567,0,0,0,0,8o,2,0,http://www.odis.be/lnk/en/PB_45761,0,Imported from 20231128_ml_ingest_odis_ml_pb.json
1592,printed,Compendiaria disserendi ratio ad praescriptum Atistotelis: continens generalia logices praecepta omnia ex toto Aristotelis organo. Commonstratus est etiam diligenter praeceptorum usus,0,Latin,1553,1553,0,0,0,0,8o,2,0,http://www.odis.be/lnk/en/PB_45762,0,Imported from 20231128_ml_ingest_odis_ml_pb.json
1593,printed,"Dialectica seu, generalia logices praecepta omnia",0,Latin,1562,1562,0,0,0,0,8o,2,0,http://www.odis.be/lnk/en/PB_45763,0,Imported from 20231128_ml_ingest_odis_ml_pb.json
1594,printed,"Dialectica seu, generalia logices praecepta omnia","quaecunque praecipue ex toto Aristotelis organo, ad ediscendum proponi consueverunt",Latin,1566,1566,0,0,0,0,8o,2,0,http://www.odis.be/lnk/en/PB_45764,0,Imported from 20231128_ml_ingest_odis_ml_pb.json
1595,printed,Isagoge Porphyrii Phenicis in categorias Aristotelis Organon,0,Latin,1525,1525,0,0,0,0,2o,2,0,http://www.odis.be/lnk/en/PB_45765,<p>philosophy =&gt; logic</p><p>textbook contains different books from Aristotle and an isagoge of Porphyrius</p><p>=&gt; Liber praedicabilium of Porphyrius</p><p>=&gt; Liber praedicamentorum of Aristotle</p><p>=&gt; Liber peri hermenias dividitur in duos libros partiales</p><p>=&gt; Liber topicoum Aristotelis in octo libros partiales dividitur</p><p>=&gt; Liber priorum analyticorum in duos dividitur</p><p>=&gt;&nbsp;Liber posteriorum Aristotelis =&gt; 2 books</p><p>=&gt; Liber elenchorum dividitur in duos libros partiales</p>,Imported from 20231128_ml_ingest_odis_ml_pb.json
1596,printed,Organon (Logica vetus),0,Latin,1474,1475,0,0,0,0,4o,2,0,http://www.odis.be/lnk/en/PB_45772,<p>philosophy =&gt; logic</p>,Imported from 20231128_ml_ingest_odis_ml_pb.json
1597,printed,De generatione et corruptione,0,Latin,1475,1475,0,0,0,0,2o,2,0,http://www.odis.be/lnk/en/PB_45773,<p>natural philosophy</p>,Imported from 20231128_ml_ingest_odis_ml_pb.json
1598,printed,Analytica priora,0,Latin,1475,1475,0,0,0,0,2o,2,0,http://www.odis.be/lnk/en/PB_45775,<p>philosophy =&gt; logic</p>,Imported from 20231128_ml_ingest_odis_ml_pb.json
1599,printed,Physica,0,Latin,1475,1475,0,0,0,0,2o,2,0,http://www.odis.be/lnk/en/PB_45776,<p>natural philosophy</p>,Imported from 20231128_ml_ingest_odis_ml_pb.json
1600,printed,Analytica posteriora,0,Latin,1476,1476,0,0,0,0,2o,2,0,http://www.odis.be/lnk/en/PB_45777,<p>philosophy =&gt; logic</p>,Imported from 20231128_ml_ingest_odis_ml_pb.json
1601,printed,Ethica ad Nicomachum,0,Latin,1476,1476,0,0,0,0,2o,2,0,http://www.odis.be/lnk/en/PB_45778,<p>ethics</p><p>moral philosophy</p>,Imported from 20231128_ml_ingest_odis_ml_pb.json
1602,printed,Enchiridium ethicum ex Aristotele olim collectum,Nunc latinè versum ab Erycio Puteano,Latin,1620,1620,0,0,0,0,8o,2,0,http://www.odis.be/lnk/en/PB_45779,0,Imported from 20231128_ml_ingest_odis_ml_pb.json
1603,printed,"Physica, seu Generalia philosophiae naturalis theoremata, è libris Aristotelis desumpta","Quae passim in academiis physicae studiosis memoriae mandanda praescribuntur/	Omnia & in faciles versus redacta quo promptius memoriae insigantur, & scholiis illustrata, quo facilius intelligantur",Latin,1610,1610,0,0,0,0,8o,2,0,http://www.odis.be/lnk/en/PB_45781,"<p>Textbook follows a university course on natural philosophy</p><p>=&gt; the 8 books of the&nbsp;<em>Physica</em></p><p><em>=&gt;&nbsp;</em>the 4 books of&nbsp;<em>De Coelo</em></p><p><em>=&gt;&nbsp;</em>the 2 books of&nbsp;<em>De Generatione et Corruptione</em></p><p><em>=&gt;&nbsp;</em>the 3 books of&nbsp;<em>De Meteoris</em></p><p><em>=&gt;&nbsp;</em><span id=""_mce_caret"" data-mce-bogus=""true"" style="""">﻿the 3 books of&nbsp;<span id=""_mce_caret"" data-mce-bogus=""true"" style=""""><em>﻿De Anima</em></span></span></p>",Imported from 20231128_ml_ingest_odis_ml_pb.json
1604,printed,Prodidagmata sive Logicae pars prima introductoria ad organum Aristotelis,0,Latin,1627,1628,0,0,0,0,4o,2,0,http://www.odis.be/lnk/en/PB_45782,0,Imported from 20231128_ml_ingest_odis_ml_pb.json
1605,printed,Organon (Logica Vetus),0,Latin,1474,1474,0,0,0,0,4o,5,0,http://www.odis.be/lnk/en/PB_45784,<p>philosophy =&gt; logic</p>,Imported from 20231128_ml_ingest_odis_ml_pb.json
1606,printed,"Defensio confessionis ministrorum Jesu Christi, ecclesiae antuerpiensis, quae Augustanae confessioni adsentitur, contra judoci tiletani varia sophismata...] Addita est [...] adhortatio ad piam Constantiam ",0,0,1567,0,0,0,0,0,0,0,0,http://www.odis.be/lnk/en/PB_45932,0,Imported from 20231128_ml_ingest_odis_ml_pb.json
1607,printed,"Defensio confessionis ministrorum Jesu Christi, ecclesiae antuerpiensis, quae Augustanae confessioni adsentitur, contra judoci tiletani varia sophismata[...]Cum praevia adhoratione [...] Addita est [...] adhortatio ad piam Constantiam [...]",0,Latin,1567,0,0,0,0,0,8o,0,0,http://www.odis.be/lnk/en/PB_45933,"<p><br data-mce-bogus=""1""></p><div id=""ConnectiveDocSignExtentionInstalled"" data-extension-version=""1.0.4""></div>",Imported from 20231128_ml_ingest_odis_ml_pb.json
1608,printed,Summulae logicales: Textus summularum,0,Latin,1474,1474,0,0,0,0,4o,5,0,http://www.odis.be/lnk/en/PB_45955,<p>Philosophy =&gt; logic</p>,Imported from 20231128_ml_ingest_odis_ml_pb.json
1609,printed,Institutiones (with the Glossa ordinaria of Accursius),0,Latin,1475,1475,0,0,0,0,2o,2,0,http://www.odis.be/lnk/en/PB_45956,<p>Law</p>,Imported from 20231128_ml_ingest_odis_ml_pb.json
1610,printed,Repertorium juris,0,0,1475,1475,0,0,0,0,2o,2,0,http://www.odis.be/lnk/en/PB_45957,<p>Law =&gt; Canon law</p>,Imported from 20231128_ml_ingest_odis_ml_pb.json
1611,printed,Processus iudiciarius,0,Latin,1475,1475,0,0,0,0,2o,2,0,http://www.odis.be/lnk/en/PB_45958,<p>Law</p>,Imported from 20231128_ml_ingest_odis_ml_pb.json
1612,printed,Breviarium super Codicem,0,Latin,1477,1477,0,0,0,0,2o,2,0,http://www.odis.be/lnk/en/PB_45959,<p>Law</p>,Imported from 20231128_ml_ingest_odis_ml_pb.json
1613,printed,Summulae logicales,0,0,1477,1483,0,0,0,0,4o,2,0,http://www.odis.be/lnk/en/PB_45960,<p>Philosophy =&gt; logic</p>,Imported from 20231128_ml_ingest_odis_ml_pb.json
1614,printed,Vocabularius juris utriusque,0,Latin,1477,1478,0,0,0,0,2o,2,0,http://www.odis.be/lnk/en/PB_45961,<p>Law =&gt; dictionary</p>,Imported from 20231128_ml_ingest_odis_ml_pb.json
1615,printed,Modus legendi abbreviaturas in utroq. iure,0,Latin,1483,1483,0,0,0,0,2o,2,0,http://www.odis.be/lnk/en/PB_45962,<p>Law</p>,Imported from 20231128_ml_ingest_odis_ml_pb.json
1616,printed,Casus summarii Decretalium Sexti et Clementinarum,0,Latin,1480,1480,0,0,0,0,2o,2,0,http://www.odis.be/lnk/en/PB_45963,<p>Law =&gt; Canon Law</p>,Imported from 20231128_ml_ingest_odis_ml_pb.json
1617,printed,Processus iudiciarius,0,Latin,1481,1483,0,0,0,0,2o,2,0,http://www.odis.be/lnk/en/PB_45964,<p>Law</p>,Imported from 20231128_ml_ingest_odis_ml_pb.json
1618,printed,De consolatione philosophiae,0,Latin,1484,1484,0,0,0,0,2o,2,0,http://www.odis.be/lnk/en/PB_45965,<p>Philosophy =&gt; logic</p>,Imported from 20231128_ml_ingest_odis_ml_pb.json
1619,printed,De consolatione philosophiae,0,Latin,1487,1487,0,0,0,0,2o,2,0,http://www.odis.be/lnk/en/PB_45966,<p>Philosophy =&gt; logic</p>,Imported from 20231128_ml_ingest_odis_ml_pb.json
1620,printed,Methodus utriusque iuris,0,Latin,1483,1484,0,0,0,0,2o,2,0,http://www.odis.be/lnk/en/PB_45971,<p>Law</p>,Imported from 20231128_ml_ingest_odis_ml_pb.json
1621,printed,Casus longi super quinque libros decretalium,0,Latin,1484,1484,0,0,0,0,2o,2,0,http://www.odis.be/lnk/en/PB_45972,<p>Canon Law</p>,Imported from 20231128_ml_ingest_odis_ml_pb.json
1622,printed,Annotationes ad Justiniani Institutiones,0,Latin,1486,1488,0,0,0,0,2o,2,0,http://www.odis.be/lnk/en/PB_45973,<p>Law</p>,Imported from 20231128_ml_ingest_odis_ml_pb.json
1623,printed,Commentum super decem praeceptis decalogi,0,Latin,1486,1486,0,0,0,0,2o,2,0,http://www.odis.be/lnk/en/PB_45974,<p>Canon Law</p><p>Theology</p>,Imported from 20231128_ml_ingest_odis_ml_pb.json
1624,printed,Super institutiones,0,Latin,1486,1488,0,0,0,0,2o,2,0,http://www.odis.be/lnk/en/PB_45975,<p>Civil Law</p>,Imported from 20231128_ml_ingest_odis_ml_pb.json
1625,printed,Modus legendi abbreviaturas,0,Latin,1488,1488,0,0,0,0,2o,2,0,http://www.odis.be/lnk/en/PB_45977,<p>Law</p>,Imported from 20231128_ml_ingest_odis_ml_pb.json
1626,printed,Methodus utriusque juris,0,Latin,1488,1488,0,0,0,0,2o,2,0,http://www.odis.be/lnk/en/PB_45978,<p>Law</p>,Imported from 20231128_ml_ingest_odis_ml_pb.json
1627,printed,Lectura super titulo De actionibus institutionum,0,Latin,1475,1475,0,0,0,0,2o,2,0,http://www.odis.be/lnk/en/PB_45979,<p>Civil Law</p>,Imported from 20231128_ml_ingest_odis_ml_pb.json
1628,printed,Ινστιτουτιωνες,0,Greek; Latin,1536,1536,0,0,0,0,4o,2,0,http://www.odis.be/lnk/en/PB_45982,<p>Civil Law</p>,Imported from 20231128_ml_ingest_odis_ml_pb.json
1629,printed,Topicoru[m] seu de locis legalibus liber,0,Latin,1516,1516,0,0,0,0,2o,2,0,http://www.odis.be/lnk/en/PB_45984,<p>Law</p>,Imported from 20231128_ml_ingest_odis_ml_pb.json
1630,printed,"Isagoge, id est introductio in dialecticen. Opera omnia, quae pertinent ad inventionem et judicationem dialecticae",0,Latin,1554,1554,0,0,0,0,2o,2,0,http://www.odis.be/lnk/en/PB_45986,<p>philosophy =&gt; logic</p>,Imported from 20231128_ml_ingest_odis_ml_pb.json
1631,printed,Paratitla sive Summaria et methodica explicatio decretalium D. Gregorii papae IX,0,Latin,1631,1631,0,0,0,0,4o,2,0,http://www.odis.be/lnk/en/PB_45987,<p>Canon Law</p>,Imported from 20231128_ml_ingest_odis_ml_pb.json
1632,printed,Paratitla sive Summaria et methodica explicatio decretalium D. Gregorii papae IX,"Editio altera, emendatior & indicibus auctior",Latin,1632,1632,0,0,0,0,4o,2,0,http://www.odis.be/lnk/en/PB_45989,<p>Canon Law</p>,Imported from 20231128_ml_ingest_odis_ml_pb.json
1633,printed,Paratitla sive Summaria et methodica explicatio decretalium D. Gregorii papae IX,"Editio tertia, emendatior & indicibus auctior",Latin,1640,1640,0,0,0,0,4o,2,0,http://www.odis.be/lnk/en/PB_45990,<p>Canon Law</p>,Imported from 20231128_ml_ingest_odis_ml_pb.json
1634,printed,Paratitla sive Summaria et methodica explicatio Decretalium D. Gregorii Papae IX,"Editio quarta & ultima, post tres Lovanienses",Latin,1640,1640,0,0,0,0,4o,2,0,http://www.odis.be/lnk/en/PB_45991,<p>Canon Law</p>,Imported from 20231128_ml_ingest_odis_ml_pb.json
1635,printed,Paratitla sive Summaria et methodica explicatio decretalium D. Gregorii papae IX,Editio emendatior,Latin,1642,1642,0,0,0,0,4o,2,0,http://www.odis.be/lnk/en/PB_45992,<p>Canon Law</p>,Imported from 20231128_ml_ingest_odis_ml_pb.json
1636,printed,Paratitla sive Summaria et methodica explicatio decretalium D. Gregorii papae IX,"Editio quarta, emendatior & indicibus auctior",Latin,1649,1649,0,0,0,0,4o,2,0,http://www.odis.be/lnk/en/PB_45994,<p>Canon Law</p>,Imported from 20231128_ml_ingest_odis_ml_pb.json
1637,printed,Paratitla sive Summaria et methodica explicatio decretalium D. Gregorii papae IX,"Editio quinta, emendatior & indicibus auctior",Latin,1658,1658,0,0,0,0,4o,2,0,http://www.odis.be/lnk/en/PB_45995,<p>Canon Law</p>,Imported from 20231128_ml_ingest_odis_ml_pb.json
1638,printed,"Paratitla, sive Svmmaria et methodica explicatio decretalivm D. Gregorii papae IX","Editio vltima, a pluribus, quibus antè scatebat, mendis purgata",Latin,1682,1682,0,0,0,0,4o,2,0,http://www.odis.be/lnk/en/PB_45996,<p>Canon Law</p>,Imported from 20231128_ml_ingest_odis_ml_pb.json
1639,printed,"Paratitla Iuris Canonici, Sive Decretalium Greg. Papae IX. Summaria Ac Methodica Explicatio",Editio nova a mendis purgata/Opus omnibus tam in schola quam in foro versantibus utilißimum ,Latin,1651,1651,0,0,0,0,4o,737,0,http://www.odis.be/lnk/en/PB_45997,<p>Canon Law</p>,Imported from 20231128_ml_ingest_odis_ml_pb.json
1640,printed,"Paratitla Iuris Canonici, Sive Decretalium Greg. Papae IX. Summaria Ac Methodica Explicatio",Opus omnibus tam in schola quam in foro versantibus utilissimum/Editio nova a mendis purgata,Latin,1661,1661,0,0,0,0,4o,737,0,http://www.odis.be/lnk/en/PB_45998,<p>Canon Law</p>,Imported from 20231128_ml_ingest_odis_ml_pb.json
1641,printed,"Paratitla Iuris Canonici, Sive Decretalium Gregorii Papae IX. Summaria Ac Methodica Explicatio",Opus omnibus tam in schola quam in foro versantibus utilissimum/Editio nova a mendis purgata,Latin,1670,1670,0,0,0,0,4o,737,0,http://www.odis.be/lnk/en/PB_45999,<p>Canon Law</p>,Imported from 20231128_ml_ingest_odis_ml_pb.json
1642,printed,"Paratitla Iuris Canonici, Sive Decretalium D. Gregorii. Papae IX. Summaria Ac Methodica Explicatio","Editio Novissima cum triplici Indice/Opus novum, Scholae ac Foro, & Decretis Concilii Tridentini accommodatum",Latin,1686,1686,0,0,0,0,4o,2,0,http://www.odis.be/lnk/en/PB_46000,0,Imported from 20231128_ml_ingest_odis_ml_pb.json
1643,printed,"Paratitla Iuris Canonici, Sive Decretalium D. Gregorii. Papae IX. Summaria Ac Methodica Explicatio","Opus novum, Scholae ac Foro, & Decretis Concilii Tridentini accommodatum/Editio Novissima verbo initiali ad quamlibet citationem aucta & ab innumeris mendis expurgata. Cum triplice Indice",Latin,1700,1700,0,0,0,0,4o,737,0,http://www.odis.be/lnk/en/PB_46001,<p>Canon Law</p>,Imported from 20231128_ml_ingest_odis_ml_pb.json
1644,printed,Praelectiones in codicem Justinianeum,0,Latin,1642,1642,0,0,0,0,2o,2,0,http://www.odis.be/lnk/en/PB_46003,<p>Civil Law</p>,Imported from 20231128_ml_ingest_odis_ml_pb.json
1645,printed,"Nomenclatura legum, quibus praecipua juris civilis capita continentur, ad Adrianum filium: ordo studii juris civilis",0,Latin,1551,1551,0,0,0,0,8o,2,0,http://www.odis.be/lnk/en/PB_46014,<p>Civil Law</p>,Imported from 20231128_ml_ingest_odis_ml_pb.json
1646,printed,"Nomenclatura Legum; quibus praecipua Iuris Civilis capita continentur, ad Adrianum filium. Ordo studii iuris",0,Latin,1576,1576,0,0,0,0,0,2,0,http://www.odis.be/lnk/en/PB_46015,<p>Civil Law</p>,Imported from 20231128_ml_ingest_odis_ml_pb.json
1647,printed,De iure pacis commentarius,0,Latin,1620,1620,0,0,0,0,4o,2,0,http://www.odis.be/lnk/en/PB_46031,<p>Civil Law</p>,Imported from 20231128_ml_ingest_odis_ml_pb.json
1648,printed,De iure feudorum commentarius,0,Latin,1624,1624,0,0,0,0,4o,2,0,http://www.odis.be/lnk/en/PB_46032,<p>Feudal Law</p>,Imported from 20231128_ml_ingest_odis_ml_pb.json
1649,printed,Casus breves super totum corpus legum vel iuris civilis,"ex lecturis Bartoli de Saxoferrato, Baldi de Ubaldis et Jacobi de Bellovisu (Digesta)",Latin,1478,1478,0,0,0,0,2o,116,0,http://www.odis.be/lnk/en/PB_46033,<p>Civil Law</p>,Imported from 20231128_ml_ingest_odis_ml_pb.json
1650,printed,Casus breves super totum corpus legum vel iuris civilis,"ex lecturis Bartoli de Saxoferrato, Baldi de Ubaldis et Jacobi de Bellovisu (Digesta)",Latin,1480,1480,0,0,0,0,2o,1297,0,http://www.odis.be/lnk/en/PB_46034,<p>Civil Law</p>,Imported from 20231128_ml_ingest_odis_ml_pb.json
1651,printed,Casus breves super totum corpus legum vel iuris civilis,"ex lecturis Bartoli de Saxoferrato, Baldi de Ubaldis et Jacobi de Bellovisu (Digesta (I)/Codex, Institutiones, Authentica. Liber feudorum (II). Partes I-II",Latin,1481,1485,0,0,0,0,2o,5364,0,http://www.odis.be/lnk/en/PB_46035,<p>Civil Law</p><p>Feudal Law</p>,Imported from 20231128_ml_ingest_odis_ml_pb.json
1652,printed,De iure feudorum commentarius,0,Latin,1641,1641,0,0,0,0,4o,2,0,http://www.odis.be/lnk/en/PB_46036,<p>Printed together with a textbook of Henricus Zoesius =&gt;&nbsp;Praelectiones feudales (ODIS/<span>PB_46370)</span></p>,Imported from 20231128_ml_ingest_odis_ml_pb.json
1653,printed,De iure pacis commentarius,In quo praecipuae de hoc iure quaestiones distinctis capitibus eleganter pertractantur/Editio secunda,Latin,1641,1641,0,0,0,0,4o,2,0,http://www.odis.be/lnk/en/PB_46037,<p>Civil Law</p>,Imported from 20231128_ml_ingest_odis_ml_pb.json
1654,printed,De iure feudorum et pacis commentarii,0,Latin,1663,1663,0,0,0,0,4o,2,0,http://www.odis.be/lnk/en/PB_46038,<p>Feudal Law</p><p>Civil Law</p>,Imported from 20231128_ml_ingest_odis_ml_pb.json
1655,printed,De iure pacis commentarius,0,Latin,1663,1663,0,0,0,0,4o,2,0,http://www.odis.be/lnk/en/PB_46039,<p>Civil Law</p>,Imported from 20231128_ml_ingest_odis_ml_pb.json
1656,printed,"Ad titulos dig. & cod. de testamentis commentarius, iuris Romani & morum hodiernorum differentias continens",0,Latin,1653,1653,0,0,0,0,8o,2,0,http://www.odis.be/lnk/en/PB_46040,<p>Law</p>,Imported from 20231128_ml_ingest_odis_ml_pb.json
1657,printed,Commentariorum de iure novissimo libri sex,"optimâ methodo, accuratè ac eruditè conscripti, additis harum vicinarumque regionum moribus",Latin,1620,1620,0,0,0,0,2o,26,0,http://www.odis.be/lnk/en/PB_46041,<p>Civil Law</p>,Imported from 20231128_ml_ingest_odis_ml_pb.json
1658,printed,Commentariorum de iure novissimo libri sex,0,Latin,1644,1644,0,0,0,0,2o,26,0,http://www.odis.be/lnk/en/PB_46042,<p>Civil Law</p>,Imported from 20231128_ml_ingest_odis_ml_pb.json
1659,printed,Syntagma regularum iuris utriusque,0,Latin,1646,1646,0,0,0,0,2o,26,0,http://www.odis.be/lnk/en/PB_46045,<p>Law</p>,Imported from 20231128_ml_ingest_odis_ml_pb.json
1660,printed,Opera omnia,0,Latin,1685,1685,0,0,0,0,2o,26,0,http://www.odis.be/lnk/en/PB_46046,<p>Civil Law</p>,Imported from 20231128_ml_ingest_odis_ml_pb.json
1661,printed,Commentariorum de iure novissimo libri sex,0,Latin,1639,1639,0,0,0,0,4o,28,0,http://www.odis.be/lnk/en/PB_46047,<p>Civil Law</p>,Imported from 20231128_ml_ingest_odis_ml_pb.json
1662,printed,Commentariorum de iure novissimo libri sex,0,Latin,1643,1643,0,0,0,0,4o,28,0,http://www.odis.be/lnk/en/PB_46048,<p>Civil Law</p>,Imported from 20231128_ml_ingest_odis_ml_pb.json
1663,printed,Super Institutiones,0,Latin,1481,1482,0,0,0,0,2o,737,0,http://www.odis.be/lnk/en/PB_46052,<p>Civil Law</p>,Imported from 20231128_ml_ingest_odis_ml_pb.json
1664,printed,Super Institutiones,0,Latin,1482,1482,0,0,0,0,2o,737,0,http://www.odis.be/lnk/en/PB_46053,<p>Civil Law</p>,Imported from 20231128_ml_ingest_odis_ml_pb.json
1665,printed,Commentariorum de iure novissimo libri sex,0,Latin,1661,1661,0,0,0,0,4o,28,0,http://www.odis.be/lnk/en/PB_46056,<p>Civil Law</p>,Imported from 20231128_ml_ingest_odis_ml_pb.json
1666,printed,De iure pacis commentarius,0,Latin,1648,1648,0,0,0,0,12o,5004,0,http://www.odis.be/lnk/en/PB_46057,<p>Law</p>,Imported from 20231128_ml_ingest_odis_ml_pb.json
1667,printed,De iure feudorum et pacis commentarii,Editio Quarta Correctior,Latin,1663,1663,0,0,0,0,8o,737,0,http://www.odis.be/lnk/en/PB_46058,<p>Civil Law</p><p>Feudal Law</p>,Imported from 20231128_ml_ingest_odis_ml_pb.json
1668,printed,De iure pacis commentarius,Editio Quarta,Latin,1663,1663,0,0,0,0,8o,737,0,http://www.odis.be/lnk/en/PB_46060,<p>Civil Law</p>,Imported from 20231128_ml_ingest_odis_ml_pb.json
1669,printed,Commentariorum de iure novissimo libri sex,Editio Novissima,Latin,1668,1668,0,0,0,0,4o,3255,0,http://www.odis.be/lnk/en/PB_46061,<p>Civil Law</p>,Imported from 20231128_ml_ingest_odis_ml_pb.json
